{
  "schema": "juicyfruit.task-event/v1",
  "id": "EVT-01M2H1TJZTGCVVKFK79E",
  "task": "JCF-01M2H1DSNZZY7GZDXMH7",
  "type": "checkpointed",
  "created_at": "2026-09-14T22:50:24.122509Z",
  "data": {
    "completed": [
      "Testes unitarios cobrindo lifecycle completo blocked-unblocked repetido e serializacao JSON"
    ],
    "current": "Pronto para verify",
    "remaining": [],
    "changed_files": [
      "cli/test/src/task_runtime/task_runtime_report_test.dart"
    ],
    "validations": {
      "dart_test": "pass_269_tests"
    },
    "next_action": "verify e done"
  }
}
