{
  "schema": "juicyfruit.task-event/v1",
  "id": "EVT-01M1HX9F45VG3T3JCQRF",
  "task": "JCF-01M1HWH2NPYY7JDDWQQ5",
  "type": "checkpointed",
  "created_at": "2026-09-02T20:34:41.414424Z",
  "data": {
    "completed": [
      "Completed full validation and independent instruction review"
    ],
    "current": "Ready for task verification",
    "remaining": [],
    "changed_files": [],
    "validations": {
      "format": "pass",
      "analysis": "pass",
      "tests": "pass",
      "manifest_contracts": "pass",
      "instruction_review": "approved"
    },
    "next_action": "Move task to verification and completion"
  }
}
