{
  "schema": "juicyfruit.task-event/v1",
  "id": "EVT-01M1HJBKBCB92EDJ887T",
  "task": "JCF-01M1HJ0Z61HR8WPG3QQ9",
  "type": "checkpointed",
  "created_at": "2026-09-02T17:23:36.940043Z",
  "data": {
    "completed": [
      "automatic setup filters declared targets by configured local target roots",
      "memory setup captures configured targets before creating its own .juicyfruit skeleton",
      "generic target auto-detection requires existing content markers",
      "ready tasks now sort by priority before age",
      "master flow documented across task runtime and workflow skills"
    ],
    "current": "verification complete",
    "remaining": [
      "none"
    ],
    "changed_files": [
      "cli/lib/src/package/installation_adapters.dart",
      "cli/lib/src/commands/setup_command.dart",
      "cli/lib/src/commands/memory_command.dart",
      "cli/lib/src/task_runtime/task_runtime_store.dart",
      "docs/architecture/task-runtime.md"
    ],
    "validations": {
      "dart_analyze": "passed",
      "dart_test": "passed"
    },
    "next_action": "review and commit"
  }
}
