{
  "schema": "juicyfruit.task-event/v1",
  "id": "EVT-01M2H84AAKFE1Q7Q9XEX",
  "task": "JCF-01M2H820XGH00HZWYSFP",
  "type": "checkpointed",
  "created_at": "2026-09-15T00:40:34.388180Z",
  "data": {
    "completed": [
      "Adicionada verificacao de permissao de escrita no diretorio de instalacao em install.sh",
      "Adicionado smoke test de execucao do binario pos-instalacao em install.sh e install.ps1",
      "Validada sintaxe do script de shell com sh -n",
      "Suite completa de 308 testes passando"
    ],
    "current": null,
    "remaining": [],
    "changed_files": [
      "scripts/install.sh",
      "scripts/install.ps1"
    ],
    "validations": {
      "syntax": "clean",
      "tests": "308_passed"
    },
    "next_action": "Marcar tarefa como verify e done atualizar checklist do plano e commitar"
  }
}
