{
  "schema": "juicyfruit.task-event/v1",
  "id": "EVT-01M2H0G1FEH1TEFKYT6B",
  "task": "JCF-01M2H033V2M8FHENBRT8",
  "type": "checkpointed",
  "created_at": "2026-09-14T22:27:09.934834Z",
  "data": {
    "completed": [
      "Criado scripts/dart-sandbox.sh: resolve o binário real do dart-sdk (bypass do wrapper fvm) e isola $HOME em .juicyfruit/runtime/dart-sandbox-home (git-ignored)",
      " preservando PUB_CACHE real",
      "Validado: pub get",
      " analyze --fatal-infos --fatal-warnings",
      " format --set-exit-if-changed e test todos passam com exit 0 via o wrapper",
      "Documentado uso do wrapper no README.md raiz e cli/README.md"
    ],
    "current": "Falta atualizar checklist do plano de melhoria (Fase 1.1) e commitar",
    "remaining": [],
    "changed_files": [
      "scripts/dart-sandbox.sh",
      "README.md",
      "cli/README.md"
    ],
    "validations": {},
    "next_action": null
  }
}
