{
  "schema": "juicyfruit.task-event/v1",
  "id": "EVT-01M2GZBH8RHN5PCMQYSH",
  "task": "JCF-01M2GZA9PQTAGZFP6HBE",
  "type": "checkpointed",
  "created_at": "2026-09-14T22:07:13.688522Z",
  "data": {
    "completed": [
      "Explorei estrutura do repo (README",
      " CLI Dart",
      " agents",
      " packages",
      " task runtime",
      " adapters",
      " memory)",
      "Revisei docs/PLANO_MELHORIA_EVOLUCAO_JUICYFRUIT.md existente e validei suas alegações contra o código-fonte",
      "Reproduzi falha real de I/O do dart/fvm tentando escrever em diretorio global (confirma gap 1 do plano)",
      "Confirmei ausencia de 'task report'/'task board' via grep no codigo e docs",
      "Confirmei que adapters/ na raiz so tem .gitkeep e que memory keyword_search.dart nao tem parametro de peso hibrido ajustavel"
    ],
    "current": "Deliverable pronto: docs/PLANO_MELHORIA_EVOLUCAO_JUICYFRUIT.md com opiniao critica e plano de 4 fases",
    "remaining": [],
    "changed_files": [],
    "validations": {},
    "next_action": null
  }
}
