{
  "schema": "juicyfruit.task-event/v1",
  "id": "EVT-01M1HHVPARGWDZY5FPXA",
  "task": "JCF-01M1HH5NT019CYVHGJVM",
  "type": "checkpointed",
  "created_at": "2026-09-02T17:14:55.704530Z",
  "data": {
    "completed": [
      "setup --all now uses declared package targets",
      "added devin gemini-cli via adapters and schema/package support",
      "removed implicit claude-code memory setup target",
      "coalesced English Portuguese Spanish README structure",
      "updated architecture docs and changelog"
    ],
    "current": "verification complete",
    "remaining": [
      "none"
    ],
    "changed_files": [
      "cli/lib/src/commands/setup_command.dart",
      "cli/lib/src/package/installation_adapters.dart",
      "cli/lib/src/commands/memory_command.dart",
      "README.md",
      "README.pt-BR.md",
      "README.es.md"
    ],
    "validations": {
      "dart_analyze": "passed",
      "dart_test": "passed",
      "hud_pytest": "blocked_pytest_missing"
    },
    "next_action": "review and commit"
  }
}
