{
  "schema": "juicyfruit.task-event/v1",
  "id": "EVT-01M1HX056N2PY84PRYB4",
  "task": "JCF-01M1HWH2NPYY7JDDWQQ5",
  "type": "checkpointed",
  "created_at": "2026-09-02T20:29:36.342617Z",
  "data": {
    "completed": [
      "Authored canonical skills and review agent",
      "Refactored technical planner workflow",
      "Updated core packages documentation and changelog"
    ],
    "current": "Run final validation and independent review",
    "remaining": [
      "Resolve validation findings if any"
    ],
    "changed_files": [
      "agents/agent-instruction-reviewer.md",
      "agents/planner.md",
      "skills/plan/SKILL.md",
      "packages/skills-core/package.yaml"
    ],
    "validations": {},
    "next_action": "Run the full Dart suite after independent instruction review"
  }
}
