{
  "schema": "juicyfruit.task-event/v1",
  "id": "EVT-01M2H8G9ZCN9CHTXT8PJ",
  "task": "JCF-01M2H86YEVH5T37J3BP1",
  "type": "checkpointed",
  "created_at": "2026-09-15T00:47:07.245319Z",
  "data": {
    "completed": [
      "Adicionados subcomandos juicyfruit source sync e juicyfruit source search",
      "Implementada busca de pacotes baseada em id/name/description usando PackageCatalog",
      "Implementada sincronizacao de fontes registradas usando SourceRegistry.test",
      "Adicionados testes unitarios e de subcomando em source_command_test.dart",
      "Validada suite completa com 308 testes passando e analise sem avisos"
    ],
    "current": null,
    "remaining": [],
    "changed_files": [
      "cli/lib/src/commands/source_command.dart",
      "cli/test/src/commands/source_command_test.dart"
    ],
    "validations": {
      "format": "clean",
      "analyze": "clean",
      "tests": "308_passed"
    },
    "next_action": "Marcar tarefa como verify e done atualizar o checklist do plano e commitar"
  }
}
