{
  "schema": "juicyfruit.task-event/v1",
  "id": "EVT-01M2H7GY0NZFGYC7BKYG",
  "task": "JCF-01M2H5M0T06N935CAKBG",
  "type": "checkpointed",
  "created_at": "2026-09-15T00:29:59.190549Z",
  "data": {
    "completed": [
      "Criado MemoryCompactReport em memory_models.dart",
      "Implementado compactJournal em MemoryStore movendo day-files para .archive e gerando nota de resumo consolidada",
      "Adicionado subcomando juicyfruit memory compact com flags --older-than e --dry-run e suporte a escopos",
      "Escrita de testes de unidade cobrindo MemoryStore.compactJournal (6 testes novos)",
      "Escrita de testes de CLI cobrindo juicyfruit memory compact (4 testes novos)",
      "Validacao completa com 303 de 303 testes passando e analyze/format limpos"
    ],
    "current": null,
    "remaining": [],
    "changed_files": [
      "cli/lib/src/memory/memory_models.dart",
      "cli/lib/src/memory/memory_store.dart",
      "cli/lib/src/commands/memory_command.dart",
      "cli/test/src/memory/memory_store_test.dart",
      "cli/test/src/commands/memory_command_test.dart"
    ],
    "validations": {
      "format": "clean",
      "analyze": "clean",
      "tests": "303_passed"
    },
    "next_action": "Marcar tarefa como verify e done atualizar checklist do plano e commitar"
  }
}
