{
  "schema": "juicyfruit.task-event/v1",
  "id": "EVT-01M1D7KWPWZ7ME2H3S00",
  "task": "JCF-01M1D7A8WBWH05BXZ65H",
  "type": "checkpointed",
  "created_at": "2026-09-01T00:58:56.604718Z",
  "data": {
    "completed": [
      "documented task event schema and stale lock recovery",
      "documented config-driven session memory capture"
    ],
    "current": "full verification",
    "remaining": [
      "commit follow-up debt fixes"
    ],
    "changed_files": [
      "README.md",
      "CHANGELOG.md",
      "docs/architecture/task-runtime.md",
      "docs/architecture/sessions.md"
    ],
    "validations": {
      "focused_tests": "passed"
    },
    "next_action": "run full formatter analyzer and test suite"
  }
}
