{
  "schema": "juicyfruit.task-event/v1",
  "id": "EVT-01M1D7P13QS3TGEKVHJF",
  "task": "JCF-01M1D7A8WBWH05BXZ65H",
  "type": "checkpointed",
  "created_at": "2026-09-01T01:00:06.647617Z",
  "data": {
    "completed": [
      "formatter stable with zero changes"
    ],
    "current": "final analyzer and full test suite",
    "remaining": [
      "commit follow-up debt fixes"
    ],
    "changed_files": [],
    "validations": {
      "format": "passed"
    },
    "next_action": "run analyzer and full tests"
  }
}
