{
  "schema": "juicyfruit.task-event/v1",
  "id": "EVT-01M2H7ZVHS360HW8RJDR",
  "task": "JCF-01M2H7T7ZNZ9T10718EJ",
  "type": "checkpointed",
  "created_at": "2026-09-15T00:38:08.186311Z",
  "data": {
    "completed": [
      "Criado DeclarativeAdapterLoader em declarative_adapter_loader.dart para carregar e mesclar adaptadores declarativos de adapters/",
      "Exportado DeclarativeAdapterLoader em package.dart",
      "Adicionados arquivos adapter.yaml padronizados sob adapters/ para codex claude-code cursor antigravity devin gemini-cli via e generic",
      "Adicionados testes unitarios em declarative_adapter_loader_test.dart",
      "Validada suite completa com 308 testes passando e analise sem avisos"
    ],
    "current": null,
    "remaining": [],
    "changed_files": [
      "cli/lib/src/package/declarative_adapter_loader.dart",
      "cli/lib/src/package/package.dart",
      "cli/test/src/package/declarative_adapter_loader_test.dart"
    ],
    "validations": {
      "format": "clean",
      "analyze": "clean",
      "tests": "308_passed"
    },
    "next_action": "Marcar tarefa como verify e done atualizar o checklist do plano e commitar"
  }
}
