{
  "schema": "juicyfruit.task-event/v1",
  "id": "EVT-01M2H1WZXXK03A7E1BT5",
  "task": "JCF-01M2H1DSNZZY7GZDXMH7",
  "type": "checkpointed",
  "created_at": "2026-09-14T22:51:42.910240Z",
  "data": {
    "completed": [],
    "current": null,
    "remaining": [],
    "changed_files": [],
    "validations": {
      "dart_test": "pass_269_tests"
    },
    "next_action": null
  }
}
